{
  "schemaVersion": "1.0.0",
  "id": "de-a1-unit-daily-routine-work-school",
  "languageId": "de",
  "level": "A1",
  "titleFa": "روتین روزانه: کار و مدرسه",
  "learningTargets": [
    "دربارهٔ کارهای معمول در بخش‌های مختلف روز پرسش و پاسخ کوتاه را بفهمد.",
    "زمان‌های سادهٔ روز مانند صبح، پیش از ظهر، ظهر و بعدازظهر را به کارهای روزمره وصل کند.",
    "اطلاعات ساده دربارهٔ کار یا مدرسه را در بافت روتین روزانه بفهمد و بیان کند.",
    "چند کار روزمره را به‌صورت توالی زمانی ساده دنبال کند."
  ],
  "lessonRefs": [
    "de-a1-lesson-daily-routine-work",
    "de-a1-lesson-daily-routine-school",
    "de-a1-lesson-daily-routine-day-review"
  ],
  "groupingRationale": "دو درس نخست مسیر صبح و پیش‌ازظهرِ کار و مدرسه را می‌سازند؛ درس سوم نیمهٔ دوم روز را با خرید بعدازظهر و فعالیت‌های شبانه گسترش می‌دهد تا روتین فقط به همان صحنه‌های قبلی محدود نماند.",
  "sourceRefs": [
    "src-wikibooks-de-lesson-022-daily-routine"
  ],
  "status": "final",
  "notes": "هر سه درس بخش زمانی و کارکرد متفاوتی دارند: کار، مدرسه، و فعالیت‌های بعدازظهر/شب."
}
