{
  "schemaVersion": "1.0.0",
  "id": "de-a1-unit-family-and-close-people",
  "languageId": "de",
  "level": "A1",
  "titleFa": "خانواده و افراد نزدیک",
  "learningTargets": [
    "اعضای بسیار پرتکرار خانواده مانند پدر، مادر، برادر و خواهر را در بافت منبع‌دار تشخیص دهد.",
    "اطلاعات سادهٔ یک عضو خانواده مانند نام، سن، محل زندگی یا شغل را بفهمد و در حد A1 دربارهٔ آن پرسش و پاسخ کند.",
    "الگوهای مالکیت لازم برای صحبت دربارهٔ خانواده را فقط در حدی که منابع و سناریوی واقعی درس توجیه می‌کنند به کار ببرد.",
    "اطلاعات مربوط به یک فرد نزدیک را به‌صورت چند جملهٔ مرتبط بفهمد، نه مجموعه‌ای از واژه‌های جدا از هم."
  ],
  "lessonRefs": [
    "de-a1-lesson-family-brother-profile",
    "de-a1-lesson-family-parents-profile",
    "de-a1-lesson-family-profile-review"
  ],
  "groupingRationale": "واحد ابتدا اطلاعات پایهٔ خواهر و برادر و سپس والدین را پوشش می‌دهد؛ درس سوم محور تازهٔ مکان را اضافه می‌کند و از زبان‌آموز می‌خواهد محل تحصیل یا زندگی اعضای خانواده را بفهمد و بپرسد.",
  "sourceRefs": [
    "src-wikibooks-de-lesson-007-family"
  ],
  "status": "final",
  "notes": "سه درس خانواده اکنون نام/سن/شغل، والدین، و محل تحصیل/زندگی را به‌عنوان سه زیرمهارت مستقل پوشش می‌دهند."
}
