{
  "schemaVersion": "1.0.0",
  "id": "de-a1-unit-shopping-quantity-payment",
  "languageId": "de",
  "level": "A1",
  "titleFa": "خرید، پرداخت و سفارش غذا",
  "learningTargets": [
    "قیمت یک کالا را در گفت‌وگوی کوتاه بپرسد و پاسخ قیمت را بفهمد.",
    "مقدارهای سادهٔ خرید مانند گرم و کیلو را در درخواست و پاسخ تشخیص دهد.",
    "یک کالای دیگر را به خرید اضافه کند و مقدار موردنظر را بفهمد یا بیان کند.",
    "پایان خرید و رفتن به صندوق برای پرداخت را در گفت‌وگوی روزمره بفهمد.",
    "در یک سفارش کوتاه دربارهٔ قلم دیگری، موجودبودن خوراکی و قیمت سؤال کند و پاسخ را بفهمد.",
    "نوشیدنی را با شیر/شکر یا بدون یکی از آن‌ها شخصی‌سازی کند.",
    "وقتی یک قلم موجود نیست، جایگزین پیشنهادی را در پاسخ کوتاه بفهمد.",
    "Ö و Ü را در چند نمونهٔ کوتاه و منبع‌دار واضح بخواند."
  ],
  "lessonRefs": [
    "de-a1-lesson-shopping-price-review",
    "de-a1-lesson-shopping-quantity-payment",
    "de-a1-lesson-shopping-checkout-review",
    "de-a1-lesson-food-preference-review",
    "de-a1-lesson-expanded-food-order",
    "de-a1-lesson-food-combinations-review"
  ],
  "groupingRationale": "این واحد شش درس دارد چون دو بخش متوالیِ یک مهارت تراکنشی روزمره را پوشش می‌دهد: ابتدا انتخاب کالا، مقدار، قیمت و پرداخت و سپس سفارش و شخصی‌سازی غذا و نوشیدنی. هر شش درس یک زنجیرهٔ کاربردی از درخواست تا انتخاب، مقدار، قیمت و ترجیح را می‌سازند و نگه‌داشتن دو Unit سه‌درسی برای یک خانوادهٔ ارتباطی واحد، مرزبندی مصنوعی ایجاد می‌کرد.",
  "sourceRefs": [
    "src-wikibooks-de-lesson-009-shopping",
    "src-wikibooks-de-lesson-004",
    "src-wikibooks-de-lesson-007-food-order",
    "src-coerll-dib-pronunciation-umlauts"
  ],
  "status": "final",
  "notes": "واحد خرید و سفارش غذا برای حذف مرز سهمیه‌ای ادغام شد؛ Lessonها و محتوای آلمانی بدون تغییر باقی مانده‌اند."
}
