{
  "schemaVersion": "1.0.0",
  "id": "de-a1-unit-expanded-food-order",
  "languageId": "de",
  "level": "A1",
  "titleFa": "سفارش گسترده‌تر غذا و نوشیدنی",
  "learningTargets": [
    "در یک سفارش کوتاه بیش از یک قلم خوراکی یا نوشیدنی درخواست کند و پاسخ فروشنده را بفهمد.",
    "پرسش رایج دربارهٔ اینکه چیز دیگری می‌خواهد را در بافت سفارش بفهمد و پاسخ مناسب بدهد.",
    "ترجیح ساده را با خواستن یک مورد و نخواستن مورد دیگر در جملهٔ منبع‌دار تشخیص دهد.",
    "واحدهای سادهٔ سرو مانند تکه و فنجان را در سفارش روزمره بفهمد."
  ],
  "lessonRefs": [
    "de-a1-lesson-food-preference-review",
    "de-a1-lesson-expanded-food-order",
    "de-a1-lesson-food-combinations-review"
  ],
  "groupingRationale": "واحد سفارش غذا را در سه مسئلهٔ متفاوت تمرین می‌کند: شخصی‌سازی نوشیدنی، سفارش چندقلمی، و مدیریت ناموجودبودن یک قلم با فهم جایگزین پیشنهادی.",
  "sourceRefs": [
    "src-wikibooks-de-lesson-007-food-order"
  ],
  "status": "final",
  "notes": "درس‌های اول و سوم از بخش‌های استفاده‌نشدهٔ همان منبع می‌آیند و مهارت‌های تازهٔ شخصی‌سازی و جایگزینی را اضافه می‌کنند."
}
