{
  "schemaVersion": "1.0.0",
  "id": "de-a1-unit-extended-introduction",
  "languageId": "de",
  "level": "A1",
  "titleFa": "معرفی، کار، زبان‌ها و خانواده",
  "learningTargets": [
    "اطلاعات قبلیِ نام، محل زندگی و مبدأ را در یک معرفی پیوسته بازیابی کند، بدون اینکه این موارد دوباره به‌عنوان هدف تازه آموزش داده شوند.",
    "کار یا شغل را با الگوهای منبع‌دار بسیار ساده در معرفی شخصی بفهمد و بیان کند.",
    "زبان‌هایی را که فرد صحبت می‌کند یا یاد می‌گیرد در جمله‌های کوتاه و منبع‌دار بفهمد و بیان کند.",
    "یک معرفی کوتاه A1 را به‌عنوان مجموعه‌ای از اطلاعات مرتبط دربارهٔ یک نفر بفهمد، نه چند جملهٔ جدا از هم.",
    "اعضای بسیار پرتکرار خانواده مانند پدر، مادر، برادر و خواهر را در بافت منبع‌دار تشخیص دهد.",
    "اطلاعات سادهٔ یک عضو خانواده مانند نام، سن، محل زندگی یا شغل را بفهمد و در حد A1 دربارهٔ آن پرسش و پاسخ کند.",
    "الگوهای مالکیت لازم برای صحبت دربارهٔ خانواده را فقط در حدی که منابع و سناریوی واقعی درس توجیه می‌کنند به کار ببرد.",
    "اطلاعات مربوط به یک فرد نزدیک را به‌صورت چند جملهٔ مرتبط بفهمد، نه مجموعه‌ای از واژه‌های جدا از هم."
  ],
  "lessonRefs": [
    "de-a1-lesson-profession-profile",
    "de-a1-lesson-work-and-languages",
    "de-a1-lesson-integrated-introduction-review",
    "de-a1-lesson-family-brother-profile",
    "de-a1-lesson-family-parents-profile",
    "de-a1-lesson-family-profile-review"
  ],
  "groupingRationale": "این واحد شش درس دارد چون یک مسیر پیوستهٔ «شناخت و معرفی افراد» را می‌سازد: سه درس نخست معرفی فرد، شغل و زبان‌ها را گسترش می‌دهند و سه درس بعد همان اطلاعات شخصی را به خانواده و افراد نزدیک منتقل می‌کنند. جداکردن این دو خوشه مرز آموزشی واقعی ایجاد نمی‌کرد و ادغام آن‌ها بازیابی اطلاعات شخصی را در یک بافت تازه ممکن می‌کند؛ شش درس نتیجهٔ این توالی است، نه هدف عددی.",
  "sourceRefs": [
    "src-wikibooks-bll-a1-lesson-1",
    "src-wikibooks-bll-a1-lesson-2",
    "src-wikibooks-de-lesson-002-professions",
    "src-wikibooks-de-lesson-007-family"
  ],
  "status": "final",
  "notes": "واحد معرفی و خانواده در بازبینی ساختار داینامیک ادغام شد؛ هیچ متن آلمانی یا Activity تغییر نکرده است."
}
