{
  "schemaVersion": "1.0.0",
  "id": "de-a1-unit-health-doctor-pharmacy",
  "languageId": "de",
  "level": "A1",
  "titleFa": "سلامت، پزشک و داروخانه",
  "learningTargets": [
    "علائم بسیار رایج بیماری را در پرسش و پاسخ کوتاه بیان و تشخیص دهد.",
    "نسخه، دارو و محل گرفتن دارو را در یک موقعیت سادهٔ پزشکی بفهمد.",
    "با الگوی سادهٔ «دیگر ندارم» بهترشدن یک علامت را بیان کند."
  ],
  "lessonRefs": [
    "de-a1-lesson-health-symptoms",
    "de-a1-lesson-health-medicine-pharmacy",
    "de-a1-lesson-health-recovery"
  ],
  "groupingRationale": "واحد از بیان مستقیم علامت شروع می‌کند، سپس مسیر نسخه و داروخانه را پوشش می‌دهد و در پایان به پیگیری حال بیمار و بیان بهترشدن می‌رسد. سه درس سه مرحلهٔ واقعی و مستقل از یک مراجعهٔ سادهٔ پزشکی هستند.",
  "sourceRefs": [
    "src-wikibooks-de-lesson-018-health"
  ],
  "status": "final",
  "notes": "دامنه عمداً به علائم رایج، داروخانه و پیگیری کوتاه محدود شده است و ساختارهای پیچیده‌تر گفت‌وگوی پزشک وارد A1 نمی‌شوند."
}
