{
  "schemaVersion": "1.0.0",
  "id": "de-a1-unit-time-plans-appointment",
  "languageId": "de",
  "level": "A1",
  "titleFa": "زمان، برنامه و قرار",
  "learningTargets": [
    "بازهٔ زمانی یک برنامه را با ساعت شروع و پایان بفهمد.",
    "پرسش و پاسخ دربارهٔ «تا چه زمانی» را در برنامهٔ روزمره بفهمد.",
    "یک دعوت ساده، رد مؤدبانه و پیشنهاد روز جایگزین را دنبال کند.",
    "پاسخ مناسب به یک زمان مشخص برای قرار را تشخیص دهد."
  ],
  "lessonRefs": [
    "de-a1-lesson-time-class-schedule",
    "de-a1-lesson-time-simple-appointment",
    "de-a1-lesson-time-plans-review"
  ],
  "groupingRationale": "واحد از فهم بازهٔ زمانی به دعوت و برنامه می‌رسد و در درس سوم مذاکرهٔ ساعت دقیق را اضافه می‌کند: رد یک زمان، پیشنهاد زمان/محل جایگزین و تأیید مناسب‌بودن آن.",
  "sourceRefs": [
    "src-wikibooks-de-lesson-021-time-appointment"
  ],
  "status": "final",
  "notes": "درس سوم دیگر جمع‌بندی نیست؛ یک چرخهٔ ارتباطی مستقلِ رد زمان و توافق روی زمان تازه را آموزش می‌دهد."
}
