{
  "schemaVersion": "1.0.0",
  "id": "de-a1-unit-weather-temperature",
  "languageId": "de",
  "level": "A1",
  "titleFa": "آب‌وهوا",
  "learningTargets": [
    "دربارهٔ هوای فعلی یک شهر سؤال کند و پاسخ ساده را بفهمد.",
    "وضعیت‌های سادهٔ باد، گرما، آفتاب و ابر را تشخیص دهد.",
    "وضعیت‌های سادهٔ باران و برف را از هم تشخیص دهد.",
    "یک تقابل کوتاه V/W را با نمونهٔ منبع‌دار تمرین کند.",
    "در پایان A1 یک پرسش سلامت را از آب‌وهوا و حمل‌ونقل تشخیص دهد."
  ],
  "lessonRefs": [
    "de-a1-lesson-weather-current",
    "de-a1-lesson-weather-rain-plan",
    "de-a1-lesson-weather-temperature"
  ],
  "groupingRationale": "واحد فقط روی هوای فعلی متمرکز است: باد/گرما، آفتاب/ابر و باران/برف. پیش‌بینی سنگین حذف شده و یک تمرین کوتاه V/W و یک بازیابی بین‌واحدی پایان A1 اضافه شده‌اند.",
  "sourceRefs": [
    "src-wikibooks-de-weather-appendix",
    "src-coerll-dib-weather",
    "src-coerll-dib-pronunciation-consonants",
    "src-wikibooks-de-lesson-018-health",
    "src-wikibooks-de-transport-dialogue-current"
  ],
  "status": "final",
  "notes": "شناسهٔ فنی واحد برای سازگاری تاریخی حفظ شده، اما محتوای فعال دیگر دما را به‌عنوان محور مستقل آموزش نمی‌دهد. منبع قدیمی هواشناسی نسخهٔ چاپی از محتوای فعال کنار گذاشته شده است."
}
