{
  "schemaVersion":"1.0.0","id":"de-a1-unit-home-and-nearby","languageId":"de","level":"A1","titleFa":"خانه و محیط نزدیک","learningTargets":["واژه‌های پرتکرار برای اتاق و وسایل سادهٔ داخل آن را در بافت منبع‌دار تشخیص دهد.","دربارهٔ تعلق داشتن یا شناسایی یک وسیلهٔ سادهٔ خانه پرسش و پاسخ کوتاه را بفهمد.","اطلاعات بسیار ساده دربارهٔ محل قرارگیری یا ویژگی یک اتاق و وسایل آن را بفهمد.","واژگان خانه را به اطلاعات واقعیِ محل زندگی متصل کند، نه اینکه فقط فهرست اشیا را حفظ کند."],"lessonRefs":["de-a1-lesson-room-table-lamp","de-a1-lesson-room-position"],"groupingRationale":"پس از معرفی خود و افراد نزدیک، دامنهٔ A1 به محیط فوری زندگی گسترش می‌یابد. این واحد از اشیای ملموس و پرسش‌های کوتاه شروع می‌کند و سپس به ویژگی و موقعیت سادهٔ اجزای محیط می‌رسد؛ ترتیب از شناخت ساده به توصیف محدود حرکت می‌کند.","sourceRefs":["src-wikibooks-de-lesson-007-room-objects","src-wikibooks-de-lesson-009-room-position"],"status":"review","notes":"بازبینی پوشش انجام شد. دو درس موجود وسایل پایهٔ اتاق، مالکیت ساده، موقعیت راست و چپ و جلو و عقب و یک ویژگی سادهٔ خانه را پوشش می‌دهند. برای هدف فعلی این واحد شکاف ضروری مستقلی برای درس سوم پیدا نشد؛ توصیف گسترده‌تر مکان بعداً در واحد مسیر و مکان‌های عمومی ادامه پیدا می‌کند."
}
